{
  "schemaVersion": 1,
  "editionDate": "2026-10-05",
  "sourceDate": "2026-10-04",
  "status": "ready",
  "updatedAt": "2026-10-04T23:10:00Z",
  "timezone": "Asia/Tokyo",
  "notice": "対象日に公開された記事を精査し、実務に結びつく内容を確認できた1件を掲載しています。件数合わせのための旧記事は含めていません。",
  "articles": [
    {
      "id": "axis-bank-adi-agentic-ai",
      "region": "world",
      "category": "business_case",
      "title": "Axis Bank、行内AIアシスタント「Adi」の利用が75万回超と説明",
      "summary": "The Financial Expressのインタビューで、Axis BankのIT・リテール業務担当責任者アヴィナシュ・ラガヴェンドラ氏は、従業員向けAIアシスタント「Adi」が累計75万回超のやり取りに使われ、月間アクティブユーザーは3万5,000人超だと述べた。同行は10年以上にわたりリスク管理や不正検知にAI・機械学習を使い、今後は生成AIやエージェント型AIを反復業務、サービス効率化、業務フローの自動化へ広げる方針を語っている。",
      "whyItMatters": "大規模金融機関の社内アシスタント活用に加え、複数工程をまたぐ自動化を検討する際、AIガバナンスや外部モデルへの依存管理も同時に進める実務上の論点が見える。",
      "publisher": "The Financial Express",
      "originalUrl": "https://www.financialexpress.com/business/news/ai-is-moving-from-recommendation-to-autonomous-execution-avinash-raghavendra/4353377/",
      "publicationDateJst": "2026-10-04",
      "publishedAtOriginal": "2026-10-04 17:47 IST (UTC+05:30)",
      "publicationDate": "2026-10-04",
      "publicationDateNote": "原文の公開日時は2026年10月4日17:47 IST。日本時間に換算すると同日21:17 JST。",
      "eventDateNote": "インタビュー記事の公開日を記載。利用実績や今後の計画について、別の出来事の日付は記事に記載なし。",
      "selfReportedMetrics": true,
      "metricsNote": "利用回数と月間アクティブユーザー数は、銀行幹部がインタビューで説明した自己申告値。測定期間・独立検証は記事に記載なし。エンドツーエンド業務の自動化は今後の構築・検討事項で、全面稼働済みとは述べていない。",
      "sourceType": "原媒体の幹部インタビュー",
      "vendors": [
        "Axis Bank"
      ]
    }
  ]
}
